{
  "taskId": "task-001",
  "condition": "structured-handoff-plus-gate",
  "continuationSuccess": true,
  "falseCompletion": false,
  "tokenCost": 10300,
  "timeToFirstUsefulEdit": 92,
  "irrelevantFileReadCount": 0,
  "repeatedExplorationCount": 0,
  "handoffCompleteness": 2,
  "handoffFaithfulness": 1,
  "handoffMinimality": 1,
  "handoffActionability": 2,
  "notes": [
    "Synthetic pilot result for verifying scorer and aggregate plumbing.",
    "Faithfulness remains placeholder-scored until state-based review is implemented."
  ]
}
